{
  "schemaVersion": 1,
  "addonId": "atmosphere",
  "name": "A StoryWealth: Atmosphere",
  "author": "A StoryWealth Team",
  "version": "1.4.2",
  "description": "Weather, lighting and atmosphere overhaul layer for A StoryWealth.",
  "homepage": "https://www.nexusmods.com/fallout4/mods/00000",
  "requires": {
    "baseCollectionId": "astorywealth",
    "baseRevision": 42
  },
  "scope": "recommended",
  "installPriority": 100,
  "capabilities": {
    "eslFlagging": true
  },
  "gameVersion": {
    "target": "1.10.163",
    "f4se": "0.6.23",
    "method": "depot"
  },
  "mods": [
    {
      "source": "nexus",
      "nexus": { "modId": 12345, "fileId": 98765, "game": "fallout4" },
      "installAs": "aSW Atmosphere - Core",
      "hash": "sha256:0000000000000000000000000000000000000000000000000000000000000000"
    },
    {
      "source": "nexus",
      "nexus": { "modId": 12346, "fileId": 98766, "game": "fallout4" },
      "installAs": "aSW Atmosphere - Team Patches",
      "mkdir": ["MCM\\Settings\\aSWAtmosphere"],
      "patchTarget": {
        "against": ["Some Base Mod@base", "Interior Lighting@base"],
        "kind": "esp-overwrite"
      }
    }
  ],
  "plugins": [
    {
      "plugin": "aSWAtmosphere.esp",
      "enabled": true,
      "loadAfter": ["DLCCoast.esm"],
      "esl": "as-is"
    }
  ],
  "iniTweaks": [
    {
      "file": "Fallout4Custom.ini",
      "section": "Weather",
      "key": "bEnabled",
      "value": "1",
      "action": "set"
    }
  ],
  "conflicts": [
    {
      "with": "desolation",
      "resolution": "wins",
      "note": "Atmosphere weather records win; Desolation's dead-weather variants are dropped."
    }
  ]
}
